full_text,likes,comments,shares,total_engagement,outlier_score,hook_type,topic,angle,structure,visual_format,first_line,hook_150,hook,url,date,_source,rank,followers,author_avg,source
"I think I’ve seen the future of software in how I do my work… and here’s what I think…

Software as we know it is doomed… and not exactly because of vibe coding. Or those grumpy engineers that hate vibe coding.

It’s because it’s designed to trap up in their worldview, with their tools, with interfaces we must click on, with subpar voice interfaces, with all of these opinions that make us adjust OUR behavior to their opinions on what we should do.

I think the future of software willl be more bespoke workflows that are hardened and trusted that I can envoke and pay for like an API.

Will people vibe code their own CRMs, I dunno, that kinda stuff seems sticker to me as it’s critical infrastructure.

But most software is not (meeting note takers, watch out) and most software forces us to use it, to learn it, and to horde our work and make it impossible to export our data.

More so than the data is the context tho, prompts, workflows.

Most software has no place to store our intent, what we want to accomplish, who we are, what our goals are… they all force us to do it their way.

So the huge divide between software and outcomes will be both our context, integrations with our tools that can act autonomously, and compounding plus silo’d understanding of the tasks we need to do.

While engineers moan that “vibe coding will never replace Salesforce because of X, Y, and Z” (true I think), they miss the huge gigantic point that these models:

1. Are amazing at low stakes tasks (daily life)
2. Can capture an understand intent like a person
3. Can build workflows locally to do things that have low risks
4. And that all of the above makes us FASTER at doing TASKS in ONE SHOT.

There’s a revolution coming, slowly but surely, and those that will win will think about how custom code can start eliminating tasks for them.

And as it eats away at task, and if you’re on the frontier, you can charge a lot of money for very little work… simply by understanding the compound nature of value and working in the future, but taking money from today’s economy.",65.0,15.0,0,80.0,1.23,Fortune Teller,Tools/Tech,Personal Experience,List Post,Text-only,I think I’ve seen the future of software in how I do my work… and here’s what I think…,"I think I’ve seen the future of software in how I do my work… and here’s what I think…

Software as we know it is doomed… and not exactly because of v","I think I’ve seen the future of software in how I do my work… and here’s what I think…

Software as we know it is doomed… and not exactly because of v",https://www.linkedin.com/posts/jordancrawford_i-think-ive-seen-the-future-of-software-activity-7405717947882647552-zPid?utm_source=combined_share_message&utm_medium=member_desktop&rcm=ACoAAFgjPbUBezTI8Hq3YZEHPDYXMhtl4HhVFkU,2025-12-13T21:19:10.361Z,idea_legos_nacho,102,0,53.0,
"Sales pros, finish this sentence “I saw that you…” in a way that doesn’t feel like a sales email.

Wrong answers only.

Also, enjoy this deep cut roast of Zoomed in me….",43.0,37.0,0,80.0,0.81,Contrarian,GTM/Sales,Personal Experience,Short Punch,Text-only,"Sales pros, finish this sentence “I saw that you…” in a way that doesn’t feel like a sales email.","Sales pros, finish this sentence “I saw that you…” in a way that doesn’t feel like a sales email.

Wrong answers only.

Also, enjoy this deep cut roas","Sales pros, finish this sentence “I saw that you…” in a way that doesn’t feel like a sales email.

Wrong answers only.

Also, enjoy this deep cut roas",https://www.linkedin.com/posts/jordancrawford_sales-pros-finish-this-sentence-i-saw-that-activity-7407566812197945344-03xs?utm_source=combined_share_message&utm_medium=member_desktop&rcm=ACoAAFgjPbUBezTI8Hq3YZEHPDYXMhtl4HhVFkU,2025-12-18T23:45:53.964Z,idea_legos_nacho,217,0,53.0,
"""Jordan is going full AGI in 2026... and starting with turning my life into Claude Skills to make GTMe choices"" - Your Favorite LinkedIn Influencer 

I had Sybill export all of my words and I will make them into Claude Skills like a copy skill and a data skill... etc...

Then I will let it make choices as me for GTM enrichment workflows in my own super secret product, AutoGTM, in the cloud.

Follow to figure out how badly I fail...",62.0,16.0,0,78.0,1.17,Teacher,GTM/Sales,Personal Experience,Observation/Opinion,Text-only,"""Jordan is going full AGI in 2026... and starting with turning my life into Claude Skills to make GT","""Jordan is going full AGI in 2026... and starting with turning my life into Claude Skills to make GTMe choices"" - Your Favorite LinkedIn Influencer 

","""Jordan is going full AGI in 2026... and starting with turning my life into Claude Skills to make GTMe choices"" - Your Favorite LinkedIn Influencer 

",https://www.linkedin.com/posts/jordancrawford_jordan-is-going-full-agi-in-2026-and-activity-7418356863811072000-cmSv?utm_source=combined_share_message&utm_medium=member_desktop&rcm=ACoAADtNJIwB7YeBWk5OSR57XvTciKjhzeBfg7M,2026-01-17T18:21:42.738Z,idea_legos_nacho,113,0,53.0,
Gmail is COMING for your sh*t marketing newsletters buddy...,59.0,17.0,0,76.0,1.11,Teacher,Marketing,Framework/How-To,Short Punch,Text-only,Gmail is COMING for your sh*t marketing newsletters buddy...,Gmail is COMING for your sh*t marketing newsletters buddy...,Gmail is COMING for your sh*t marketing newsletters buddy...,https://www.linkedin.com/posts/jordancrawford_gmail-is-coming-for-your-sht-marketing-newsletters-activity-7413466757765509120-2jne?utm_source=combined_share_message&utm_medium=member_desktop&rcm=ACoAADw0mRYBSQhH_XZIMc99PusHGtWd6FiGizw,2026-01-04T06:30:10.603Z,idea_legos_nacho,122,0,53.0,
LISTEN UP: Here are all of my awful flaws and failures… ain’t nobody on linkedin bragging about those… except me…,58.0,18.0,0,76.0,1.09,Investigator,AI/Automation,Industry Observation,Short Punch,Text-only,LISTEN UP: Here are all of my awful flaws and failures… ain’t nobody on linkedin bragging about thos,LISTEN UP: Here are all of my awful flaws and failures… ain’t nobody on linkedin bragging about those… except me…,LISTEN UP: Here are all of my awful flaws and failures… ain’t nobody on linkedin bragging about those… except me…,https://www.linkedin.com/posts/jordancrawford_listen-up-here-are-all-of-my-awful-flaws-activity-7392443922385477632--O6I?utm_source=combined_share_message&utm_medium=member_desktop&rcm=ACoAADs6jaABL787bQYRhLjcBo2NCXWQ0-9LROE,2025-11-07T06:12:56.063Z,idea_legos_nacho,125,0,53.0,
"Almost all of what I use AI for is collecting and organizing data… almost never writing… and Charlie explains why SO WELL…

Charlie has perfect pitch, he’s an incredible artist. Even Taylor Swift sang about him, “We declared Charlie Puth should be a bigger artist.”

The thing about a good message is not that it’s perfect, it’s that it’s authentic.

And the average of many authentic pieces of writing is oddly inauthentic. 

There IS a recipe for authenticity in GTM and it’s petty simple…

1. Understand the organizing principle for why your different types of customers buy (industries, use cases, jobs to be done, pain, etc). You’re looking for what unites buyers besides “they all bought my software.”

2. Go figure out what insight that group of buyers had, WHY you? If it’s because they trusted who referred them, that’s hard. You’re looking for their counter intuitive truth.

3. Use AI to figure out where the data lives where you can find batches of people in this same situation.

Then all you have to do is tell the story you learned in 2 to the customers from the list in 3.

AI won’t replace our creativity and to use to it send creative messages is weirdly missing the point.

You should use it to find the needles in the haystack and to explain what the last needle did to get out. 

And HOW you do it is the art part. And often, the surface area of intelligence from 1 and 2 is SO low or 1 for horizontal SaaS is SO HARD  that you default to mostly blasting stuff. 

But it’s the sitting on the piano moment that can’t be replicated by AI and I think our buyers will know what authenticity sounds like well into the future.

As the noise has increased a ton, but the signal has always sounded the same. 

And just like pornography, as the Supreme Court is famous for saying (paraphrasing), “I can’t define it, but you know it when you see it.”",59.0,14.0,2,75.0,1.11,Teacher,GTM/Sales,Personal Experience,List Post,Text-only,Almost all of what I use AI for is collecting and organizing data… almost never writing… and Charlie,"Almost all of what I use AI for is collecting and organizing data… almost never writing… and Charlie explains why SO WELL…

Charlie has perfect pitch,","Almost all of what I use AI for is collecting and organizing data… almost never writing… and Charlie explains why SO WELL…

Charlie has perfect pitch,",https://www.linkedin.com/posts/jordancrawford_almost-all-of-what-i-use-ai-for-is-collecting-activity-7384251668281950209-rXPc?utm_source=combined_share_message&utm_medium=member_desktop&rcm=ACoAADeyR5kBF6LdtEF6TIVH5pe79SXD6ygMAxA,2025-10-15T15:39:50.480Z,idea_legos_nacho,123,0,53.0,
Here’s how I structure my GTM Engineering Systems in Claude Code and how you can too…,50.0,19.0,0,69.0,0.94,Teacher,GTM/Sales,Personal Experience,Short Punch,Text-only,Here’s how I structure my GTM Engineering Systems in Claude Code and how you can too…,Here’s how I structure my GTM Engineering Systems in Claude Code and how you can too…,Here’s how I structure my GTM Engineering Systems in Claude Code and how you can too…,https://www.linkedin.com/posts/jordancrawford_heres-how-i-structure-my-gtm-engineering-activity-7402828935723507712-_Yl3?utm_source=combined_share_message&utm_medium=member_desktop&rcm=ACoAACMGb3oBRaMXx5ky1s8XlW5ehBwhaT5lQhE,2025-12-05T21:59:16.187Z,idea_legos_nacho,170,0,53.0,
"You can’t personalize your way out of a targeting problem.

Focus on finding evidence of the problem, then just ask them if that evidence means they are struggling with X problem.

This is called a PQS, pain qualified segment, and it will save you from looking like a silly goose trying to personalize a message about a problem your lead doesn’t have or you don’t understand.",52.0,12.0,1,65.0,0.98,Contrarian,AI/Automation,Against Common Wisdom,Observation/Opinion,Text-only,You can’t personalize your way out of a targeting problem.,"You can’t personalize your way out of a targeting problem.

Focus on finding evidence of the problem, then just ask them if that evidence means they a","You can’t personalize your way out of a targeting problem.

Focus on finding evidence of the problem, then just ask them if that evidence means they a",https://www.linkedin.com/posts/jordancrawford_you-cant-personalize-your-way-out-of-a-targeting-activity-7398027065461157889--KxV?utm_source=combined_share_message&utm_medium=member_desktop&rcm=ACoAAEPLVB8BjK8i7C_59z_zkiamiJYzSeuohxk,2025-11-22T15:58:21.102Z,idea_legos_nacho,158,0,53.0,
"Friends and family, I need your help… I have an addition…


I can’t stop using Sora 2. 

It’s a problem.",49.0,16.0,0,65.0,0.93,Contrarian,GTM/Sales,Personal Experience,Short Punch,Text-only,"Friends and family, I need your help… I have an addition…","Friends and family, I need your help… I have an addition…


I can’t stop using Sora 2. 

It’s a problem.","Friends and family, I need your help… I have an addition…


I can’t stop using Sora 2. 

It’s a problem.",https://www.linkedin.com/posts/jordancrawford_friends-and-family-i-need-your-help-i-have-activity-7388862371508903936-jT1E?utm_source=combined_share_message&utm_medium=member_desktop&rcm=ACoAAETfp90Bp8z87J9S2JZUOFkUrgejl3ypNlg,2025-10-28T09:01:07.792Z,idea_legos_nacho,177,0,53.0,
"I asked AI to tell me why we hate AI generated things so much and tbh… 


It kinda nailed it…

——-

A man can survive being poor—he’s done it for ten thousand years—but he cannot survive being unnecessary.

The machine doesn’t hate us, doesn’t love us, doesn’t know we exist, and somehow that indifference is the loneliest outcome imaginable.

What people want is to matter, to be needed by something that knows they are there, and the machine offers efficiency but it does not offer that.

So the hate isn’t really about the technology—it’s about the emptiness the technology reveals, the emptiness that was always there, papered over by busyness and the old lie that usefulness equals worth.

When the usefulness goes, the lie falls apart, and people are left holding pieces of an identity that no longer fits together.",39.0,24.0,0,63.0,0.74,Fortune Teller,AI/Automation,Personal Experience,Observation/Opinion,Text-only,I asked AI to tell me why we hate AI generated things so much and tbh…,"I asked AI to tell me why we hate AI generated things so much and tbh… 


It kinda nailed it…

——-

A man can survive being poor—he’s done it for ten ","I asked AI to tell me why we hate AI generated things so much and tbh… 


It kinda nailed it…

——-

A man can survive being poor—he’s done it for ten ",https://www.linkedin.com/posts/jordancrawford_i-asked-ai-to-tell-me-why-we-hate-ai-generated-activity-7410315985271832576-WEXb?utm_source=combined_share_message&utm_medium=member_desktop&rcm=ACoAADw0mRYBSQhH_XZIMc99PusHGtWd6FiGizw,2025-12-26T13:50:07.902Z,idea_legos_nacho,252,0,53.0,
"My next course (it’s a tool) is live… and it creates Claygents for you with Claude Code…


So far as I know this is the only course/tool that prompts YOU…

Here’s how it works.
1. You buy Clay plus $100/mo Anthropic’s Claude Max
2. You pay me $499
3. You install the tool

That’s it…  from there here is what happens

1. It asks you what you’re trying to do.
2. It builds a prompt based on examples you give
3. It asks you questions and gives you a clay template to copy 
4. It runs 10 rows, improves the prompt based on your context
5. It tries on 10 again, improves the prompt
6. It gives you quality metrics
7. It gives you instructions on how to ship 

This course is less about learning and more an invitation to come to the future with me, where the models prompt us… it is about capturing your context, it’s a gateway drug to 2026’s biggest value in GTM—context and action blended into one.

Come join me, won’t you?

Autoclaygent dot blueprintgtm dot com

Buy now.",54.0,8.0,0,62.0,1.02,Fortune Teller,AI/Automation,Industry Observation,List Post,Text-only,My next course (it’s a tool) is live… and it creates Claygents for you with Claude Code…,"My next course (it’s a tool) is live… and it creates Claygents for you with Claude Code…


So far as I know this is the only course/tool that prompts ","My next course (it’s a tool) is live… and it creates Claygents for you with Claude Code…


So far as I know this is the only course/tool that prompts ",https://www.linkedin.com/posts/jordancrawford_my-next-course-its-a-tool-is-live-and-activity-7413719469623148544-pPvw?utm_source=combined_share_message&utm_medium=member_desktop&rcm=ACoAADtNJIwB7YeBWk5OSR57XvTciKjhzeBfg7M,2026-01-04T23:14:21.805Z,idea_legos_nacho,136,0,53.0,
"nbd, just a 26 minute prompt that outputs 12 Claude Code prompts to take advantage of my 2x limits until Jan 1st…

Next week I’ll share more what I am doing… working on a handful of super secret projects…",50.0,10.0,0,60.0,0.94,Fortune Teller,AI/Automation,Industry Observation,Short Punch,Text-only,"nbd, just a 26 minute prompt that outputs 12 Claude Code prompts to take advantage of my 2x limits u","nbd, just a 26 minute prompt that outputs 12 Claude Code prompts to take advantage of my 2x limits until Jan 1st…

Next week I’ll share more what I am","nbd, just a 26 minute prompt that outputs 12 Claude Code prompts to take advantage of my 2x limits until Jan 1st…

Next week I’ll share more what I am",https://www.linkedin.com/posts/jordancrawford_nbd-just-a-26-minute-prompt-that-outputs-activity-7411911464766341120--YsC?utm_source=combined_share_message&utm_medium=member_desktop&rcm=ACoAADw0mRYBSQhH_XZIMc99PusHGtWd6FiGizw,2025-12-30T23:29:59.856Z,idea_legos_nacho,169,0,53.0,
"Merry end of 2025, my favorite group of people on the Internet! Thanks for building this LinkedIn!",51.0,7.0,0,58.0,0.96,Teacher,Product,Framework/How-To,Short Punch,Text-only,"Merry end of 2025, my favorite group of people on the Internet! Thanks for building this LinkedIn!","Merry end of 2025, my favorite group of people on the Internet! Thanks for building this LinkedIn!","Merry end of 2025, my favorite group of people on the Internet! Thanks for building this LinkedIn!",https://www.linkedin.com/posts/jordancrawford_merry-end-of-2025-my-favorite-group-of-people-activity-7411122706592489472-7K7N?utm_source=combined_share_message&utm_medium=member_desktop&rcm=ACoAADw0mRYBSQhH_XZIMc99PusHGtWd6FiGizw,2025-12-28T19:15:45.253Z,idea_legos_nacho,163,0,53.0,
"I just feel so much apathy… 

There’s an insidious thing about AI, maybe the most dehumanizing part…

That it makes me question how genuine people are based on the quality of their writing. 

As if they write like AI, I tend to round down and think even less of the message. Like somehow bad message written by a computer is even worse.

I hate questioning if the person sucks at messaging or they suck at using AI, because it’s kinda a question of what is genuine.

Let’s break this message down:

Pros:
1. It talks about me and my post.
2. It connects my value prop with what I do.
3. It mostly feels personalized, like it was written for me.

Cons:
1. It’s so so long.
2. It uses the word “interesting” which is the least interesting word in existence.
3. It says a lot without communicating anything specifically, classic AI sign.
4. It’s asking for 15 mins (a terrible amount of time, like it’s 30 or bust for me)
5. It talks about networking — No busy executive wants to network. They want to solve problems.
6. It’s just so generic as to make me feel the call will be an utter waste of time as there’s no SYNTHESIS of information.

Now contrast tho next message, which is about a specific piece of content, uses the word ingenious, is not asking me for time, and feels authentic to me.

Here’s an exercise, just write yourself a cold message YOU would happily respond to…

Here’s mine…

“Jordan, I’m 42 minutes into your video on systems of actions, systems of record, and systems of information and it’s been 3 months, what’s changed in how you’re building systems of information?”

Or here’s another one,

“Jordan I’ve heard from some friends that you do $3k campaign builds live for people in 2 hours? Can I buy that.”

Or this one,

“Jordan, I run a startup backed by a16z that builds an AI SDR for just logistics companies and we’re building it based on 17 public data sets and we’d like to make you an advisor.”

Or this one,

“Jordan I am pretty sure you’re wrong about Claude Code’s agent mode replacing Claygent—I could only get it to work for like 200 rows. What’s your secret?”

Notice that all of these messages carry specificity, they embed my point of view (the AI SDR one I would take that call because they have talked about HOW they are doing it and made choices that makes it unique).

In the other case, they want to pay me, BANGER!

In the first case they have focused 100% on my ideas, which makes me believe they literally care about the ideas. Which I love talking about of course!

And the last message is actually true, I was wrong!

There’s a thing in blockchain called proof of work, Sam McKenna says it as show me you know me, but I don’t think either of these are useful anymore.

As there are more demands on my time, I dont want you to prove you have read my things, I want you to demonstrate that you have synthesized them, disagree with them, have a damn opinion.

And in a world of AI, the winners will be those who can not just write well, but think well.",41.0,15.0,1,57.0,0.77,Teacher,AI/Automation,Personal Experience,List Post,Text-only,I just feel so much apathy…,"I just feel so much apathy… 

There’s an insidious thing about AI, maybe the most dehumanizing part…

That it makes me question how genuine people are","I just feel so much apathy… 

There’s an insidious thing about AI, maybe the most dehumanizing part…

That it makes me question how genuine people are",https://www.linkedin.com/posts/jordancrawford_i-just-feel-so-much-apathy-theres-an-activity-7389292488991129600-Phw7?utm_source=combined_share_message&utm_medium=member_desktop&rcm=ACoAAETfp90Bp8z87J9S2JZUOFkUrgejl3ypNlg,2025-10-29T13:30:15.791Z,idea_legos_nacho,232,0,53.0,
"Introucing AutoClaygent ($499)! It uses Claude Code to create Claygents for you... here is how it works...

Buy it now at autoclaygent dot com",47.0,9.0,0,56.0,0.89,Teacher,AI/Automation,Data/Numbers,Short Punch,Text-only,Introucing AutoClaygent ($499)! It uses Claude Code to create Claygents for you... here is how it wo,"Introucing AutoClaygent ($499)! It uses Claude Code to create Claygents for you... here is how it works...

Buy it now at autoclaygent dot com","Introucing AutoClaygent ($499)! It uses Claude Code to create Claygents for you... here is how it works...

Buy it now at autoclaygent dot com",https://www.linkedin.com/posts/jordancrawford_introucing-autoclaygent-499-it-uses-claude-activity-7414090584107429888-butu?utm_source=combined_share_message&utm_medium=member_desktop&rcm=ACoAADtNJIwB7YeBWk5OSR57XvTciKjhzeBfg7M,2026-01-05T23:49:02.393Z,idea_legos_nacho,189,0,53.0,
"HOT TAKE: SDRs deserve the heated replies they get from prospects.

Each week you see SDRs taking screenshots of replies from buyers that are like… “this person told me to jump off a cliff”

The invariable response looks like this:
1. Shouldn’t they know how sales works
2. We don’t want to work with people like that
3. Yah what a jerk, he must be disturbed

But this totally misses the point because 100% of the empathy is deployed to THE SELLER.

But sales isn’t about feeling sorry for ourselves, it’s not about us, it’s about the buyer.

If we are triggering our buyers to respond like that, don’t WE have the responsibility to not send messages that trigger such replies?

So here are some ideas to not get yelled at:

1. Copy and paste all your transcripts into Claude and ask, “what secrets did buyers share that are counterintuitive and give me their names and titles, here’s a spreadsheet of the calls I have uploaded to correlate them. Now you can share SECRETS of their peers.

2. Go figure out if they are hiring for roles, and see if you know someone and begin with a few recommendations for people in your network (or at your company) that would be good fits.

3. Go figure out your internal company problems and seek out vendors and explain what’s going on internally to VPs of Sales at companies who could help.

4. Go figure out if they are going to a conference and scraoe the attendees list or exhibitor list for them.

5. Want to be BALLER, go figure out who has spoke recently at conferences and send the speakers customized gifts on behalf of the conference. The go to the conference folks and share with them what you did and let them take credit.

6. Do the play above, but for recent case studies. Here’s your intro email “Jordan, I read your case study with bob at frolic construction. I did some research on bob and he loves racing so I’d like to send him a day at the track, paid for by my company, but on your behalf to thank him for his case study. His address is X from what I can tell. You want me to add a custom handwritten note? I have a budget to spend anyways, and might as well do something nice for you instead of cold pitch.”

People are just TIRED of TAKING and SAMENESS.

If you just don’t take, and try to give, and you’re like 15% weirder than everyone else… novelty plus kindness WILDLY pays off.

The only reason I haven’t had to do outbound for my business in a long time is I try to put this type of energy out into the universe.

It pays back at such a dividend that I never need to force my business to grow, it grows on its own, even when my business model is designed for 100% churn.

So stop posting mean replies, earn amazing replies, and recognize that the locus of control is on you.

You’re the only one that can plant the seeds to change your circumstance. To get upset with our buyers is to invite laziness into your thoughts, to invite a mindset of failure.

Go make exceptional experiences for your buyers and you’ll want for nothing.",39.0,16.0,0,55.0,0.74,Contrarian,GTM/Sales,Against Common Wisdom,List Post,Text-only,HOT TAKE: SDRs deserve the heated replies they get from prospects.,"HOT TAKE: SDRs deserve the heated replies they get from prospects.

Each week you see SDRs taking screenshots of replies from buyers that are like… “t","HOT TAKE: SDRs deserve the heated replies they get from prospects.

Each week you see SDRs taking screenshots of replies from buyers that are like… “t",https://www.linkedin.com/posts/jordancrawford_hot-take-sdrs-deserve-the-heated-replies-activity-7400592010841120768-A1cY?utm_source=combined_share_message&utm_medium=member_desktop&rcm=ACoAAEbZhlwBWvfv4eRw30Gb6YfF6H6xNv9ohdk,2025-11-29T17:50:31.735Z,idea_legos_nacho,253,0,53.0,
