full_text,likes,comments,shares,total_engagement,outlier_score,hook_type,topic,angle,structure,visual_format,first_line,hook_150,hook,url,date,_source,rank,followers,author_avg,source
"Today I am ??finishing?? my AutoClaygent tool for Clay AI Agents... so you never have to click in Clay again to get GREAT AI agents...

This will be part of my next course... this course will be MUCH more tool based... here's what this tool will do...

One of the things I found myself doing a LOT in clay is copying and pasting, and I was sick and tired of being a copy and paste monkey.

What I wanted was this exact process (which DOESN'T need to involve me)...

1. Interview customer as to what they want (this is me)
2. Have customer act as the AI agent and do the work manually for 50 rows
3. Capture their process + NAMED categories (e.g. how they classify things)
4. Turn it into an AI agent 
5. Have that agent judged by their context.
6. Have AI evaluate #5 and rewrite #4.

The course will be $499 I have decided and it will replace Agent 7 (which is STILL useful and STILL good, there's just a way to do it automatically).

I loved the price of Agent 7 at $299 and my other course on PVP and PQS is a seminal work at $999. But both sold about $100k each, so I want to both price maximize WHILE having more people experience my work.

You will also be required to have a $100/mo Claude Code subscription (it's just that good). So I'll be clear about that, too. You -MIGHT- need the $200/mo thing, but I don't think so.

If you want to be notified when it launches, comment below with what you want to learn!

My hope is that you too can vibe like I vibe making stuff in 2026, which is more about distilling and automating knowledge and not clicking and managing fragile workflows.",74.0,38.0,0,112.0,1.4,Fortune Teller,AI/Automation,Personal Experience,List Post,Text-only,Today I am ??finishing?? my AutoClaygent tool for Clay AI Agents... so you never have to click in Cl,"Today I am ??finishing?? my AutoClaygent tool for Clay AI Agents... so you never have to click in Clay again to get GREAT AI agents...

This will be p","Today I am ??finishing?? my AutoClaygent tool for Clay AI Agents... so you never have to click in Clay again to get GREAT AI agents...

This will be p",https://www.linkedin.com/posts/jordancrawford_today-i-am-finishing-my-autoclaygent-activity-7413310917406437376-Hdzi?utm_source=combined_share_message&utm_medium=member_desktop&rcm=ACoAADw0mRYBSQhH_XZIMc99PusHGtWd6FiGizw,2026-01-03T20:10:55.366Z,idea_legos_nacho,79,0,53.0,
"Bro is playing the LONNNNNG GAME! 
I’m a “very hot lead” in bro’s CRM.",79.0,29.0,0,108.0,1.49,Teacher,GTM/Sales,Framework/How-To,Short Punch,Text-only,Bro is playing the LONNNNNG GAME!,"Bro is playing the LONNNNNG GAME! 
I’m a “very hot lead” in bro’s CRM.","Bro is playing the LONNNNNG GAME! 
I’m a “very hot lead” in bro’s CRM.",https://www.linkedin.com/posts/jordancrawford_bro-is-playing-the-lonnnnng-game-im-a-activity-7399488829189177344-RXnt?utm_source=combined_share_message&utm_medium=member_desktop&rcm=ACoAAEPLVB8BjK8i7C_59z_zkiamiJYzSeuohxk,2025-11-26T16:46:52.733Z,idea_legos_nacho,66,0,53.0,
Sales teams: NEVER BUY A SIGNALS PRODUCT. Here’s why AI destroys that…,75.0,29.0,1,105.0,1.42,Teacher,GTM/Sales,Framework/How-To,Short Punch,Text-only,Sales teams: NEVER BUY A SIGNALS PRODUCT. Here’s why AI destroys that…,Sales teams: NEVER BUY A SIGNALS PRODUCT. Here’s why AI destroys that…,Sales teams: NEVER BUY A SIGNALS PRODUCT. Here’s why AI destroys that…,https://www.linkedin.com/posts/jordancrawford_sales-teams-never-buy-a-signals-product-activity-7404956413636182016-A1iJ?utm_source=combined_share_message&utm_medium=member_desktop&rcm=ACoAACMGb3oBRaMXx5ky1s8XlW5ehBwhaT5lQhE,2025-12-11T18:53:06.448Z,idea_legos_nacho,74,0,53.0,
"I pay $200/month and it's ALMOST not enough... the best time of my week is when my Anthropic weekly limit resets so my VIBING MAY CONTINUE.

If you're not using Claude Code, now is the time.",73.0,32.0,0,105.0,1.38,Teacher,AI/Automation,Data/Numbers,Short Punch,Text-only,I pay $200/month and it's ALMOST not enough... the best time of my week is when my Anthropic weekly ,"I pay $200/month and it's ALMOST not enough... the best time of my week is when my Anthropic weekly limit resets so my VIBING MAY CONTINUE.

If you're","I pay $200/month and it's ALMOST not enough... the best time of my week is when my Anthropic weekly limit resets so my VIBING MAY CONTINUE.

If you're",https://www.linkedin.com/posts/jordancrawford_i-pay-200month-and-its-almost-not-enough-activity-7406411348743454720-NTmA?utm_source=combined_share_message&utm_medium=member_desktop&rcm=ACoAAFgjPbUBezTI8Hq3YZEHPDYXMhtl4HhVFkU,2025-12-15T19:14:30.009Z,idea_legos_nacho,81,0,53.0,
"Today everyone is invited to watch me GTM Engineer, hands free in Claude Code. If you’re free, I’m livestream the entire thing today… 

⬇️ comment below ⬇️ to get the link DM’d…

Session will start in like an hour I think.

Session reply will be available to Cannonball GTM subscribers. 

Live is open to everyone.

EDIT: CONCLUDED!! Catch the full recording on Cannonball later!",65.0,40.0,0,105.0,1.23,Teacher,GTM/Sales,Framework/How-To,Observation/Opinion,Text-only,"Today everyone is invited to watch me GTM Engineer, hands free in Claude Code. If you’re free, I’m l","Today everyone is invited to watch me GTM Engineer, hands free in Claude Code. If you’re free, I’m livestream the entire thing today… 

⬇️ comment bel","Today everyone is invited to watch me GTM Engineer, hands free in Claude Code. If you’re free, I’m livestream the entire thing today… 

⬇️ comment bel",https://www.linkedin.com/posts/jordancrawford_today-everyone-is-invited-to-watch-me-gtm-activity-7408923395511480321-QyYw?utm_source=combined_share_message&utm_medium=member_desktop&rcm=ACoAAFgjPbUBezTI8Hq3YZEHPDYXMhtl4HhVFkU,2025-12-22T17:36:28.630Z,idea_legos_nacho,101,0,53.0,
"Gun to my head, if I had to build an AI GTM product, here’s what I would do…

First off here’s what I wouldn’t do:
1. No all in one tool, bad idea.
2. 100% no audio recording tools, unless it’s in person like limitless.ai
3. No signals
4. Nothing that involves email or email infra
5. Nothing that tries to write messages
6. No CRM
7. Never lead gen

Here’s what I would do:
1. A VERY thoughtful CRM cleaner (h/t Anders Krohn).
2. ZoomInfo for you databases.
3. A SDR / AE monitoring tool tied to systems workflow (so monitor their screens and improve their workflows).
4. Message testing framework even virtual responders based on call transcripts.
5. A call transcript connector tool that just constantly extracts the necessary context on your customers for the LLMs.

These are just a few ideas.

But for the love of god, stop building the single app to try and do all GTM. 

It’s silly and won’t work.",64.0,38.0,1,103.0,1.21,Teacher,GTM/Sales,Personal Experience,List Post,Text-only,"Gun to my head, if I had to build an AI GTM product, here’s what I would do…","Gun to my head, if I had to build an AI GTM product, here’s what I would do…

First off here’s what I wouldn’t do:
1. No all in one tool, bad idea.
2.","Gun to my head, if I had to build an AI GTM product, here’s what I would do…

First off here’s what I wouldn’t do:
1. No all in one tool, bad idea.
2.",https://www.linkedin.com/posts/jordancrawford_gun-to-my-head-if-i-had-to-build-an-ai-gtm-activity-7399121036669267968-Inaw?utm_source=combined_share_message&utm_medium=member_desktop&rcm=ACoAAEPLVB8BjK8i7C_59z_zkiamiJYzSeuohxk,2025-11-25T16:25:24.163Z,idea_legos_nacho,104,0,53.0,
We’re entering a new era of GTM from ChatGPT > Clay > Claude Code. Here’s how I see the change…,72.0,26.0,1,99.0,1.36,Fortune Teller,GTM/Sales,Industry Observation,Short Punch,Text-only,We’re entering a new era of GTM from ChatGPT > Clay > Claude Code. Here’s how I see the change…,We’re entering a new era of GTM from ChatGPT > Clay > Claude Code. Here’s how I see the change…,We’re entering a new era of GTM from ChatGPT > Clay > Claude Code. Here’s how I see the change…,https://www.linkedin.com/posts/jordancrawford_were-entering-a-new-era-of-gtm-from-chatgpt-activity-7415106698966650880-ktFe?utm_source=combined_share_message&utm_medium=member_desktop&rcm=ACoAADtNJIwB7YeBWk5OSR57XvTciKjhzeBfg7M,2026-01-08T19:06:43.054Z,idea_legos_nacho,85,0,53.0,
"If you don’t enjoy your job, and you’re reading this, there IS a WAY out.

This is my favorite book, the Wisdom of Insecurity by Alan Watts.

I want to be tactical, though, you can create your own luck. You can navigate out of your situation.

But to do so requires some advice from the Shawshank Redemption:

Pressure Over Time

Optionality is built in years and months, not days and weeks.

The best optionality is built by becoming an expert, and it’s usually by combining two things (in my case, customer empathy and data w/ AI). I’m the best in the world ONLY when you mix those three things. This is a Ben Horowitz concept, and it’s beautiful.

But the way in which you can get everything that you wanted is to find out what you enjoy doing, and just begin.

Begin by working on it, talking to people about it, building little prototypes, working for people or companies for free to learn it. 

When you do that, you subtly convince the other people that love what you love that you’re in it for passion. 

This is the single thing that people want to hire for, a hunger for the work itself. For its own sake.

Weather it’s gardening, or dental hygiene, or making hats, or ice skating… I promise you there are others out there that feel the way you feel.

Then, once you know them, and once they know your only agenda is to find joy in what you do… they FIND ways to help you. Because they see the joy, they likely feel the joy, and they want other people to feel the joy.

The people I completely avoid building relationships with are those that are money driven, not because it’s bad (I love money), but just because it’s the outcome they seek not the process they love.

That only gets you so far, because you lose your purpose when you make enough money. All that money ever got me, besides freedom from 9-5, is a ridiculously over priced coffee grinder. 

Start working on the side, finding your community, doing the things you feel drawn to… and when you do, you’ll draw in others.

And one day you’ll wake up, and you’ll have so much optionality you won’t know how to chose.

That’s when you really become free, when you get to define your days around your joy, not your job.

Invest daily now, and I promise it will compound over enough time.",79.0,11.0,0,90.0,1.49,Teacher,GTM/Sales,Framework/How-To,Story,Text-only,"If you don’t enjoy your job, and you’re reading this, there IS a WAY out.","If you don’t enjoy your job, and you’re reading this, there IS a WAY out.

This is my favorite book, the Wisdom of Insecurity by Alan Watts.

I want t","If you don’t enjoy your job, and you’re reading this, there IS a WAY out.

This is my favorite book, the Wisdom of Insecurity by Alan Watts.

I want t",https://www.linkedin.com/posts/jordancrawford_if-you-dont-enjoy-your-job-and-youre-reading-activity-7393403090701475840-EGfa?utm_source=combined_share_message&utm_medium=member_desktop&rcm=ACoAADs6jaABL787bQYRhLjcBo2NCXWQ0-9LROE,2025-11-09T21:44:19.610Z,idea_legos_nacho,67,0,53.0,
"On the 1 year anniversary, today I am announcing that a new course to replace Agent 7 is coming…",72.0,17.0,0,89.0,1.36,Magician,AI/Automation,Personal Experience,Short Punch,Text-only,"On the 1 year anniversary, today I am announcing that a new course to replace Agent 7 is coming…","On the 1 year anniversary, today I am announcing that a new course to replace Agent 7 is coming…","On the 1 year anniversary, today I am announcing that a new course to replace Agent 7 is coming…",https://www.linkedin.com/posts/jordancrawford_on-the-1-year-anniversary-today-i-am-announcing-activity-7390427305959145472-LxY1?utm_source=combined_share_message&utm_medium=member_desktop&rcm=ACoAAETfp90Bp8z87J9S2JZUOFkUrgejl3ypNlg,2025-11-01T16:39:37.240Z,idea_legos_nacho,86,0,53.0,
Claude Code and Claude Skills should be where 90% of your GTM Engineering is done… and an update on my new course…,60.0,29.0,0,89.0,1.13,Teacher,GTM/Sales,Data/Numbers,Short Punch,Text-only,Claude Code and Claude Skills should be where 90% of your GTM Engineering is done… and an update on ,Claude Code and Claude Skills should be where 90% of your GTM Engineering is done… and an update on my new course…,Claude Code and Claude Skills should be where 90% of your GTM Engineering is done… and an update on my new course…,https://www.linkedin.com/posts/jordancrawford_claude-code-and-claude-skills-should-be-where-activity-7403883412857606144-8pFU?utm_source=combined_share_message&utm_medium=member_desktop&rcm=ACoAACMGb3oBRaMXx5ky1s8XlW5ehBwhaT5lQhE,2025-12-08T19:49:23.127Z,idea_legos_nacho,119,0,53.0,
"HIRE MAX AS YOUR GTM ENGINEER... here's why you want candidates like MAX...

First off, I don't know Max, but let me tell you why someone like Max is the type of person you want:

1. He started with a framework (in this case, my PVP)
2. He took an actual brand and built with modern tools
3. He was focused on the outcome for the END user
4. He may not be the fastest yet, but clearly he's dogged

Building without frameworks is a recipe for disaster.

Here's where I'd improve what Max did
1. Why is THIS PVP relevant for this brand? Is it?

2. Great messages are built on a foundation of data, but also need to be humanized, I don't talk about this enough, but a good PVP is written from a place of confidence and translates your work from the code to value to the customer

3. Talk more about the connection between the theory and the campaign.

This is what real work looks like these days, where real value is built quickly, with a theory, around a data set and taken to maker in days not months.",77.0,10.0,0,87.0,1.45,Contrarian,GTM/Sales,Contrast/But,List Post,Text-only,HIRE MAX AS YOUR GTM ENGINEER... here's why you want candidates like MAX...,"HIRE MAX AS YOUR GTM ENGINEER... here's why you want candidates like MAX...

First off, I don't know Max, but let me tell you why someone like Max is ","HIRE MAX AS YOUR GTM ENGINEER... here's why you want candidates like MAX...

First off, I don't know Max, but let me tell you why someone like Max is ",https://www.linkedin.com/posts/jordancrawford_was-attempting-to-replicate-jordan-crawford-activity-7386142281734598656-R_Kt?utm_source=combined_share_message&utm_medium=member_desktop&rcm=ACoAADeyR5kBF6LdtEF6TIVH5pe79SXD6ygMAxA,2025-10-20T20:52:27.853Z,idea_legos_nacho,71,0,53.0,
"If you want to make it as a B2B founder, remember to post selfies that are 100% not like the real world… people EAT IT UP.

Agent 7’s successor hasn’t been named, what should I call it… Claude Code is doing all my job for me.",51.0,35.0,1,87.0,0.96,Teacher,AI/Automation,Data/Numbers,Short Punch,Text-only,"If you want to make it as a B2B founder, remember to post selfies that are 100% not like the real wo","If you want to make it as a B2B founder, remember to post selfies that are 100% not like the real world… people EAT IT UP.

Agent 7’s successor hasn’t","If you want to make it as a B2B founder, remember to post selfies that are 100% not like the real world… people EAT IT UP.

Agent 7’s successor hasn’t",https://www.linkedin.com/posts/jordancrawford_if-you-want-to-make-it-as-a-b2b-founder-activity-7393775216562397184-592p?utm_source=combined_share_message&utm_medium=member_desktop&rcm=ACoAADs6jaABL787bQYRhLjcBo2NCXWQ0-9LROE,2025-11-10T22:23:01.329Z,idea_legos_nacho,164,0,53.0,
"I have stopped an experiment that gave people a ton of value before a sale, and here's why...

So it's VERY fast for me to build a PVP or PQS list, like 30 mins -> 1 hr. 

Now this list isn't like ALWAYS production ready, but it's usually good enough for a test. So I tried just giving these things to prospects after a first call, in addition to my standard vibe coded proposal.

This was A TERRIBLE idea and probably lost me over $120k, and here's why...

People actually don't want to buy results... and hear me out.

Results are ephemeral, this is why every lead generation agency is always on the razor's edge. When I ran a lead gen agency, people said, ""sure this year I made $2M in closed/won deals and paid you $120k, BUT WHAT HAVE YOU DONE FOR ME THIS MONTH.""

This isn't true with Google or Facebook, because they have a monopoly and you have no choice, so they can enforce rules (you pay for clicks).

People would take these lists, sometimes even execute on them, and then I suspect they didn't get good results and said, ""THAT GUY SUCKS!""

This reaction is totally normal.

What people really want to buy (from me) is organizational change, they want to be able to do what I do. And I want that, too. I sort of design myself to be fired (I'm working on what a longer term engagement looks like).

Most lists fail, and that's okay, the real change that people need is to be able to launch 1 campaign every week, hopefully every few days. 

Taking a single list, that's 100% vibe coded, and thinking this represents the value was a bad idea because there's invariably a problem that neither of us could have forecasted.

The value was in the process to do it in an hour, not the output of any one hour.

I now know what I am selling, organizational change and education, not pipeline. 

The ability for YOU to generate more TESTS faster so YOU can eliminate the garbage faster and find what works.",68.0,17.0,1,86.0,1.28,Contrarian,GTM/Sales,Personal Experience,Story,Text-only,"I have stopped an experiment that gave people a ton of value before a sale, and here's why...","I have stopped an experiment that gave people a ton of value before a sale, and here's why...

So it's VERY fast for me to build a PVP or PQS list, li","I have stopped an experiment that gave people a ton of value before a sale, and here's why...

So it's VERY fast for me to build a PVP or PQS list, li",https://www.linkedin.com/posts/jordancrawford_i-have-stopped-an-experiment-that-gave-people-activity-7394787788187078656-l0R_?utm_source=combined_share_message&utm_medium=member_desktop&rcm=ACoAADs6jaABL787bQYRhLjcBo2NCXWQ0-9LROE,2025-11-13T17:26:37.217Z,idea_legos_nacho,95,0,53.0,
"0-CLICK 10 MINUTE [EASY BAKE OVEN] LEADS LIST ACHIEVED!!

I scored, sorted, and delivered a leads list with only my voice, NO UI/UX at all and I don't know if I could ever go back... seriously...

Okay so I wanted to score ALL regional banks.

1. Went to Ocean.io and got 5kish banks - downloaded locally
2. Used Serper API key
3. Used ChatGPT to do searches to find evidence of the problem + people to feed into Claude Code to build the pipeline 
4. Used ScrapIn to enrich profiles
5. Used UpCell to get cell phones

My job was done with only my voice and -ZERO- CLICKING.",62.0,23.0,0,85.0,1.17,Contrarian,GTM/Sales,Against Common Wisdom,List Post,Text-only,0-CLICK 10 MINUTE [EASY BAKE OVEN] LEADS LIST ACHIEVED!!,"0-CLICK 10 MINUTE [EASY BAKE OVEN] LEADS LIST ACHIEVED!!

I scored, sorted, and delivered a leads list with only my voice, NO UI/UX at all and I don't","0-CLICK 10 MINUTE [EASY BAKE OVEN] LEADS LIST ACHIEVED!!

I scored, sorted, and delivered a leads list with only my voice, NO UI/UX at all and I don't",https://www.linkedin.com/posts/jordancrawford_0-click-10-minute-easy-bake-oven-leads-activity-7392041330790567936-gzCU?utm_source=combined_share_message&utm_medium=member_desktop&rcm=ACoAAETfp90Bp8z87J9S2JZUOFkUrgejl3ypNlg,2025-11-06T03:33:10.747Z,idea_legos_nacho,114,0,53.0,
"In just ONE HOUR I did this, with only my voice…  this what GTM Engineering looks like in the future…

100% in Claude Code and with Apify! 

What We Did: Review Enrichment & Classification Pipeline

We built a scalable pipeline to pull and analyze Google Maps reviews for 9,732 ********* practices—every company with 150+ reviews plus all PLATINUM/GOLD tier prospects. Using Apify's Google Maps Reviews Scraper at Scale tier (128 concurrent actors), we collected 201,556 unique reviews across 9,423 locations in under 2 hours. 

Each review was then processed through Claude's Message Batches API for pain signal classification, categorizing reviews into six operational buckets: scheduling issues, communication problems, billing complaints, staff issues, legacy technology mentions, and growth constraints.

 The classification results revealed that detectable pain signals are sparse: only ~1.8% of the 161,379 processed reviews contained identifiable operational complaints (2,787 communication issues, 1,981 billing mentions, 1,930 staff problems, 1,248 scheduling complaints, 1,089 growth signals, and just 453 legacy tech mentions). 

This reinforces the validation findings—Google reviews aren't a reliable source for identifying ""******* in pain."" The signal-to-noise ratio is too low, and negative reviews often reflect one-off experiences rather than systemic operational dysfunction that would drive software purchasing decisions.

 Based on this analysis, we've assigned each of the 9,732 companies a recommended product (PRODUCT 1, PRODUCT 2, or PRODUCT 3) and a message hook tailored to their dominant signal—though 69% defaulted to the general value proposition since they lacked detectable pain. The actionable output: focus outreach on ***-change signals and ******* maturity rather than trying to infer pain from reviews. The data supports ""you're evolving, here's infrastructure that scales"" messaging over ""we see you're struggling.""

This dog is how you’ll feel like when you start building this way…",67.0,18.0,0,85.0,1.26,Fortune Teller,GTM/Sales,Data/Numbers,Observation/Opinion,Text-only,"In just ONE HOUR I did this, with only my voice…  this what GTM Engineering looks like in the future","In just ONE HOUR I did this, with only my voice…  this what GTM Engineering looks like in the future…

100% in Claude Code and with Apify! 

What We D","In just ONE HOUR I did this, with only my voice…  this what GTM Engineering looks like in the future…

100% in Claude Code and with Apify! 

What We D",https://www.linkedin.com/posts/jordancrawford_in-just-one-hour-i-did-this-with-only-my-activity-7415791638117142528-d79s?utm_source=combined_share_message&utm_medium=member_desktop&rcm=ACoAADtNJIwB7YeBWk5OSR57XvTciKjhzeBfg7M,2026-01-10T16:28:25.273Z,idea_legos_nacho,98,0,53.0,
"When I die I want just one thing…

Andreas Wernicke to give a Clay demo at my funeral.",58.0,22.0,0,80.0,1.09,Fortune Teller,Tools/Tech,Personal Experience,Short Punch,Text-only,When I die I want just one thing…,"When I die I want just one thing…

Andreas Wernicke to give a Clay demo at my funeral.","When I die I want just one thing…

Andreas Wernicke to give a Clay demo at my funeral.",https://www.linkedin.com/posts/jordancrawford_when-i-die-i-want-just-one-thing-andreas-activity-7391980273732632577-wXq1?utm_source=combined_share_message&utm_medium=member_desktop&rcm=ACoAAETfp90Bp8z87J9S2JZUOFkUrgejl3ypNlg,2025-11-05T23:30:33.610Z,idea_legos_nacho,126,0,53.0,
